{
    "assets": {
        "items": [
            {
                "asset_class": "IndustrialActivity",
                "type": "Construction",
                "location": "Asia",
                "latitude": 32.322,
                "longitude": 65.119
            },
            {
                "asset_class": "IndustrialActivity",
                "type": "Construction",
                "location": "South America",
                "latitude": -39.1009,
                "longitude": -68.5982
            }
        ]
    },
    "include_asset_level": true,
    "include_calc_details": true,
    "include_measures": true,
    "years": [
        2030,
        2040
    ],
    "scenarios": [
        "ssp126",
        "ssp245"    ]
}